{
  "subject_id": "EGD-0585",
  "idh": {
    "reasoning": "The patient is 23 years old, an age at which IDH-mutant gliomas are far more common than IDH-wildtype gliomas. The most compelling piece of evidence is the definitive presence of the T2-FLAIR mismatch sign ('T2-FLAIR Mismatch Present': 1.0, 'T2-FLAIR Mismatch Score': 0.8955), which is highly specific for IDH-mutant astrocytomas. The tumor is also largely non-enhancing ('Proportion Enhancing': 0.06%), a feature more typical of IDH-mutant tumors. While the tumor's massive size and midline crossing are aggressive features sometimes seen in IDH-wildtype tumors, these are non-specific and are outweighed by the combination of young age and the T2-FLAIR mismatch sign. Therefore, an IDH-mutant status is strongly favored.",
    "supporting_features": [
      "age_years",
      "T2-FLAIR Mismatch Present",
      "T2-FLAIR Mismatch Score",
      "Proportion Enhancing"
    ],
    "contradicting_features": [
      "Total tumor volume (mL)",
      "crosses_ideal_midline",
      "midline_shift_present"
    ],
    "prediction": "mutant",
    "confidence": 0.98
  },
  "one_p_nineteen_q": {
    "reasoning": "The prediction of 1p/19q status hinges on conflicting features. The presence of a strong T2-FLAIR mismatch sign ('T2-FLAIR Mismatch Present': 1.0) is a powerful indicator of an IDH-mutant astrocytoma, which is by definition 1p/19q non-codeleted. However, the tumor exhibits a very sharp transition zone on FLAIR imaging ('Transition Zone Thickness (FLAIR)' median_mm: 0.75), which is a classic feature of oligodendroglioma (1p/19q codeleted). The T2-FLAIR mismatch sign is generally considered more specific for the astrocytic lineage than margin sharpness is for the oligodendroglial lineage. Therefore, despite the conflicting evidence from the sharp margin, the T2-FLAIR mismatch sign carries more weight, leading to a prediction of non-codeleted status.",
    "supporting_features": [
      "T2-FLAIR Mismatch Present",
      "T2-FLAIR Mismatch Score"
    ],
    "contradicting_features": [
      "Transition Zone Thickness (FLAIR)"
    ],
    "prediction": "non-codeleted",
    "confidence": 0.75
  },
  "who_grade": {
    "reasoning": "The tumor displays features of high-grade malignancy, including its very large size ('Total tumor volume (mL)': 397.765), significant mass effect ('midline_shift_present': 'Yes'), deep white matter invasion, and ependymal invasion. These characteristics make a WHO grade 2 diagnosis highly improbable. However, the tumor is almost entirely non-enhancing ('Proportion Enhancing': 0.06%, 'ET Volume (mL)': 0.228). In the context of an IDH-mutant astrocytoma, significant necrosis (which typically presents as rim enhancement) is required for a grade 4 diagnosis on imaging. The absence of significant enhancement argues against grade 4. Therefore, WHO grade 3 is the most likely diagnosis, as it accounts for the aggressive, infiltrative nature and high tumor burden without the requisite enhancement or necrosis for grade 4.",
    "supporting_features": [
      "Total tumor volume (mL)",
      "midline_shift_present",
      "Deep WM invasion",
      "Ependymal (ventricular) Invasion",
      "crosses_ideal_midline"
    ],
    "contradicting_features": [
      "Proportion Enhancing",
      "ET Volume (mL)",
      "Enhancement Quality"
    ],
    "prediction": 3,
    "confidence": 0.8
  },
  "integrated_diagnosis": "Astrocytoma, IDH-mutant, CNS WHO grade 3",
  "consistency_check_passed": true,
  "overall_comment": "This is a massive, bilateral, infiltrative frontal lobe tumor in a very young patient. The combination of young age and a prominent T2-FLAIR mismatch sign strongly indicates an IDH-mutant astrocytoma. The lack of significant enhancement argues against grade 4, while the immense size and mass effect rule out grade 2, making grade 3 the most probable diagnosis. The very sharp tumor margin is an atypical feature for an astrocytoma, creating some uncertainty in the 1p/19q prediction, but the T2-FLAIR mismatch is a more specific marker."
}