{
  "subject_id": "BraTS2021_01035",
  "idh": {
    "reasoning": "The tumor's location in the brainstem and its midline epicenter are the strongest indicators for IDH-wildtype status, consistent with a Diffuse Midline Glioma. This is further supported by the patient's age (38), the presence of 'Marked' enhancement, and a thick enhancing margin. The absence of the T2-FLAIR mismatch sign also argues against an IDH-mutant astrocytoma. The only contradicting feature is a very sharp tumor boundary, indicated by a low transition zone thickness, which is more typical of IDH-mutant tumors but is insufficient to overcome the powerful evidence from the tumor's location and enhancement.",
    "supporting_features": [
      "Tumor Location",
      "Side of Tumor Epicenter",
      "Enhancement Quality",
      "Thickness of enhancing margin",
      "T2-FLAIR Mismatch Present",
      "age_years"
    ],
    "contradicting_features": [
      "Transition Zone Thickness (FLAIR)"
    ],
    "prediction": "wildtype",
    "confidence": 0.95
  },
  "one_p_nineteen_q": {
    "reasoning": "The prediction of non-codeletion is based primarily on the tumor's location in the brainstem. Oligodendrogliomas, which are defined by 1p/19q co-deletion, are almost exclusively supratentorial, cortically-based tumors. A brainstem location is a near-exclusion criterion. Additionally, the 'Marked' enhancement is atypical for oligodendroglioma. The only feature that could suggest co-deletion is the sharp tumor margin (low 'Transition Zone Thickness (FLAIR)'), a classic but non-specific sign of oligodendroglioma, which is strongly outweighed by the location.",
    "supporting_features": [
      "Tumor Location",
      "Side of Tumor Epicenter",
      "Enhancement Quality"
    ],
    "contradicting_features": [
      "Transition Zone Thickness (FLAIR)"
    ],
    "prediction": "non-codeleted",
    "confidence": 0.98
  },
  "who_grade": {
    "reasoning": "The prediction of WHO grade 4 is driven by the tumor's location. A diffuse glioma in the brainstem in an adult is highly suggestive of a Diffuse Midline Glioma, which is defined as WHO grade 4 in the WHO CNS5 classification, irrespective of histology. This high-grade assignment is further supported by imaging features such as 'Marked' enhancement, a 'Thickness of enhancing margin' >3mm, and the presence of necrosis ('Proportion Necrosis' > 0). The small total tumor volume is noted but does not change the grade in this context.",
    "supporting_features": [
      "Tumor Location",
      "Side of Tumor Epicenter",
      "Enhancement Quality",
      "Proportion Necrosis",
      "Thickness of enhancing margin"
    ],
    "contradicting_features": [
      "Total tumor volume (mL)"
    ],
    "prediction": 4,
    "confidence": 0.9
  },
  "integrated_diagnosis": "Diffuse midline glioma, WHO grade 4",
  "consistency_check_passed": true,
  "overall_comment": "The imaging findings are dominated by the tumor's location in the brainstem. This, in a 38-year-old patient, is highly characteristic of a Diffuse Midline Glioma. This entity is, by definition, IDH-wildtype and WHO grade 4. The presence of marked enhancement and necrosis further supports the high-grade nature. The sharp tumor boundary is an atypical feature for this entity but does not alter the overall diagnostic impression, which is driven by the highly specific location."
}