{
  "subject_id": "EGD-0636",
  "idh": {
    "reasoning": "The T2-FLAIR mismatch is absent (T2-FLAIR Mismatch Present=0.0) and necrosis proportion is high (Proportion Necrosis=22.88), both favor IDH-wildtype. Mild enhancement and cortical location could suggest IDH-mutant, but these are weaker cues. Overall the balance points to IDH-wildtype.",
    "supporting_features": [
      "T2-FLAIR Mismatch Present",
      "Proportion Necrosis"
    ],
    "contradicting_features": [
      "Cortical involvement",
      "Enhancement Quality",
      "Age"
    ],
    "prediction": "wildtype",
    "confidence": 0.66
  },
  "one_p_nineteen_q": {
    "reasoning": "IDH-wildtype tumors are by definition non\u2011codeleted for 1p/19q, and no imaging evidence (e.g., classic oligodendroglioma calcifications) supports codeletion. The frontal cortical location could hint at oligodendroglioma, but without supporting calcification or typical imaging pattern, non\u2011codeleted is more likely.",
    "supporting_features": [
      "IDH prediction (wildtype)"
    ],
    "contradicting_features": [
      "Tumor Location"
    ],
    "prediction": "non-codeleted",
    "confidence": 0.62
  },
  "who_grade": {
    "reasoning": "Necrosis is present (Proportion Necrosis=22.88) and edema is extensive (Proportion of Oedema=76.92), both imaging hallmarks of WHO grade\u202f4 glioblastoma. The enhancement is mild and does not cross midline, which argues against high grade, but necrosis alone is sufficient for grade\u202f4 in IDH\u2011wildtype tumors per WHO\u202fCNS5.",
    "supporting_features": [
      "Proportion Necrosis",
      "Proportion of Oedema"
    ],
    "contradicting_features": [
      "Enhancement Quality",
      "CET Crosses midline"
    ],
    "prediction": 4,
    "confidence": 0.68
  },
  "integrated_diagnosis": "Glioblastoma, IDH-wildtype, CNS WHO grade 4",
  "consistency_check_passed": true,
  "overall_comment": "MRI lacks advanced sequences (DWI, perfusion, spectroscopy) that could increase certainty. While imaging strongly suggests IDH-wildtype glioblastoma, the mild enhancement and cortical location introduce some residual uncertainty."
}