{
  "subject_id": "BraTS2021_01526",
  "idh": {
    "reasoning": "The lesion is non\u2011enhancing and cortical, features that often accompany IDH\u2011mutant lower\u2011grade gliomas, but it shows a high necrotic proportion (46%) and extensive edema, which are more typical of IDH\u2011wildtype high\u2011grade tumors. The absence of T2\u2011FLAIR mismatch also argues against an oligodendroglial (IDH\u2011mutant) phenotype. Age 28 would favor IDH\u2011mutant, yet the necrosis outweighs this. Balancing these opposing cues leads to a prediction of IDH\u2011wildtype.",
    "supporting_features": [
      "Proportion Necrosis",
      "Enhancement Quality",
      "T2-FLAIR Mismatch Present",
      "Edema crosses midline"
    ],
    "contradicting_features": [
      "age_years",
      "Cortical involvement",
      "Region Proportions"
    ],
    "prediction": "wildtype",
    "confidence": 0.58
  },
  "one_p_nineteen_q": {
    "reasoning": "1p/19q codeletion is strongly associated with oligodendroglioma, which typically shows a T2\u2011FLAIR mismatch and often calcifications; both are absent here. The lesion\u2019s frontal\u2011cortical location and young age could suggest codeletion, but the lack of mismatch and the presence of substantial necrosis favor a non\u2011codeleted status. Therefore the best estimate is non\u2011codeleted.",
    "supporting_features": [
      "T2-FLAIR Mismatch Present",
      "Proportion Necrosis"
    ],
    "contradicting_features": [
      "Region Proportions",
      "Cortical involvement",
      "age_years"
    ],
    "prediction": "non-codeleted",
    "confidence": 0.57
  },
  "who_grade": {
    "reasoning": "High necrotic fraction (46%) and large edema proportion (>50%) are hallmarks of WHO grade\u202f4 gliomas. The tumor also crosses the midline via edema, another high\u2011grade feature. However, the complete lack of contrast enhancement and thin enhancing margin (<3\u202fmm) are more typical of lower grades, creating uncertainty. The necrosis evidence is weighted more heavily, leading to a grade\u202f4 prediction with moderate confidence.",
    "supporting_features": [
      "Proportion Necrosis",
      "Edema crosses midline",
      "Total tumor volume (mL)",
      "Proportion of Oedema"
    ],
    "contradicting_features": [
      "Enhancement Quality",
      "Thickness of enhancing margin",
      "T2-FLAIR Mismatch Present"
    ],
    "prediction": 4,
    "confidence": 0.6
  },
  "integrated_diagnosis": "Glioblastoma, IDH-wildtype, CNS WHO grade 4",
  "consistency_check_passed": true,
  "overall_comment": "The prediction relies on conventional MRI features; lack of diffusion, perfusion, and spectroscopy limits certainty. Molecular testing (IDH1/2 sequencing, 1p/19q FISH) is recommended to confirm the genotype and refine grading."
}