{
  "subject_id": "TCGA-06-0190",
  "idh": {
    "reasoning": "The patient is 62 years old, an age typical for IDH-wildtype glioblastoma. Imaging shows marked contrast enhancement, a high proportion of edema (75.9%), ependymal invasion, deep white\u2011matter invasion and cortical involvement, all features that favor a high\u2011grade IDH-wildtype lesion. Features that argue against wildtype include the relatively low necrosis fraction (3.42%) and the fact that the enhancing component does not cross the midline, which can be seen in IDH\u2011mutant astrocytomas. Balancing these, the evidence leans toward IDH\u2011wildtype.",
    "supporting_features": [
      "age_years",
      "Enhancement Quality",
      "Proportion Enhancing",
      "Proportion of Oedema",
      "Ependymal (ventricular) Invasion",
      "Deep WM invasion",
      "Cortical involvement",
      "Edema crosses midline",
      "Effaced Ventricle",
      "Asymmetrical Ventricles",
      "CET Crosses midline"
    ],
    "contradicting_features": [
      "Proportion Necrosis",
      "CET Crosses midline",
      "Proportion Enhancing"
    ],
    "prediction": "wildtype",
    "confidence": 0.78
  },
  "one_p_nineteen_q": {
    "reasoning": "Given the prediction of IDH\u2011wildtype, the tumor cannot be 1p/19q\u2011codeleted, as codeletion occurs only in IDH\u2011mutant gliomas. No imaging features specifically suggest codeletion (such as classic frontal location or calcifications), and the high\u2011grade imaging profile aligns with non\u2011codeleted glioblastoma. Therefore the appropriate prediction is non\u2011codeleted.",
    "supporting_features": [
      "idh"
    ],
    "contradicting_features": [],
    "prediction": "non-codeleted",
    "confidence": 0.85
  },
  "who_grade": {
    "reasoning": "IDH\u2011wildtype diffuse gliomas are classified as CNS WHO grade\u202f4 regardless of other imaging features. The marked enhancement, extensive edema, ependymal and deep white\u2011matter invasion further support a grade\u202f4 assignment. Some findings (low necrosis, lack of midline crossing by the enhancing component) are more typical of lower\u2011grade lesions, but the molecular classification overrides these, leading to a grade\u202f4 prediction.",
    "supporting_features": [
      "idh",
      "Enhancement Quality",
      "Proportion of Oedema",
      "Ependymal (ventricular) Invasion",
      "Deep WM invasion"
    ],
    "contradicting_features": [
      "Proportion Necrosis",
      "CET Crosses midline",
      "Proportion Enhancing"
    ],
    "prediction": 4,
    "confidence": 0.75
  },
  "integrated_diagnosis": "Glioblastoma, IDH-wildtype, CNS WHO grade 4",
  "consistency_check_passed": true,
  "overall_comment": "The prediction relies solely on imaging metadata; molecular confirmation is lacking. Low necrosis and absence of contrast\u2011enhancing midline crossing introduce some uncertainty, but the overall profile is most consistent with an IDH\u2011wildtype glioblastoma (grade\u202f4)."
}