{
  "subject_id": "EGD-0664",
  "idh": {
    "reasoning": "The tumor shows marked contrast enhancement, a high proportion of necrosis (32.15%), a large enhancing tumor volume (31.982\u202fmL) and overall tumor volume (>100\u202fmL). These imaging hallmarks are typical of IDH\u2011wildtype glioblastoma and argue against an IDH\u2011mutant, lower\u2011grade glioma which usually exhibits less necrosis and weaker enhancement. Cortical involvement and frontal/insula location are mildly supportive of IDH\u2011mutant disease, but they are outweighed by the high\u2011grade features.",
    "supporting_features": [
      "Enhancement Quality",
      "Proportion Necrosis",
      "ET Volume (mL)",
      "Total tumor volume (mL)",
      "Ependymal (ventricular) Invasion",
      "Deep WM invasion",
      "Proportion Enhancing",
      "CET Crosses midline"
    ],
    "contradicting_features": [
      "Cortical involvement",
      "Tumor Location"
    ],
    "prediction": "wildtype",
    "confidence": 0.85
  },
  "one_p_nineteen_q": {
    "reasoning": "Marked enhancement, extensive necrosis, large tumor volume and deep white\u2011matter/ventricular invasion are characteristic of astrocytic, IDH\u2011wildtype gliomas rather than oligodendrogliomas, which typically have less necrosis and less aggressive enhancement. The frontal\u2011insula location could suggest an oligodendroglioma, but the aggressive imaging phenotype outweighs this, supporting a non\u2011codeleted status.",
    "supporting_features": [
      "Enhancement Quality",
      "Proportion Necrosis",
      "ET Volume (mL)",
      "Total tumor volume (mL)",
      "Ependymal (ventricular) Invasion",
      "Deep WM invasion",
      "Proportion Enhancing"
    ],
    "contradicting_features": [
      "Tumor Location",
      "Region Proportions",
      "Cortical involvement"
    ],
    "prediction": "non-codeleted",
    "confidence": 0.8
  },
  "who_grade": {
    "reasoning": "The combination of marked contrast enhancement, high necrotic fraction, sizable enhancing tumor component, total volume >100\u202fmL, ependymal invasion and deep white\u2011matter infiltration are imaging criteria strongly associated with WHO grade\u202f4 glioblastoma. While the proportion of enhancing tumor is moderate (\u224827\u202f%), the presence of necrosis and aggressive invasion patterns dominate, making grade\u202f4 the most plausible grade.",
    "supporting_features": [
      "Enhancement Quality",
      "Proportion Necrosis",
      "ET Volume (mL)",
      "Total tumor volume (mL)",
      "Ependymal (ventricular) Invasion",
      "Deep WM invasion",
      "Proportion Enhancing",
      "CET Crosses midline"
    ],
    "contradicting_features": [
      "Proportion Enhancing",
      "Cortical involvement"
    ],
    "prediction": 4,
    "confidence": 0.9
  },
  "integrated_diagnosis": "Glioblastoma, IDH-wildtype, CNS WHO grade 4",
  "consistency_check_passed": true,
  "overall_comment": "Advanced sequences (DWI, perfusion, spectroscopy) are unavailable, limiting molecular inference. Nonetheless, conventional MRI features strongly favor an IDH\u2011wildtype, 1p/19q non\u2011codeleted glioblastoma (grade\u202f4). The cortical and frontal location introduces minor uncertainty, but does not change the overall assessment."
}