{
  "consistency_check_passed": true,
  "idh": {
    "confidence": 0.95,
    "contradicting_features": [
      "age_years"
    ],
    "prediction": "wildtype",
    "reasoning": "The patient is 68 years old, which is typical for IDH-wildtype glioblastoma. IDH-mutant gliomas are more common in younger patients.",
    "supporting_features": [
      "age_years"
    ]
  },
  "integrated_diagnosis": "Glioblastoma, IDH-wildtype",
  "one_p_nineteen_q": {
    "confidence": 0.9,
    "contradicting_features": [
      "Eloquent Brain Involvement",
      "Tumor Location"
    ],
    "prediction": "non-codeleted",
    "reasoning": "The tumor involves eloquent areas (Speech motor and Vision) and is located in temporal, cortex, occipital and ventricles lobes, which is atypical for oligodendrogliomas that are IDH-mutant and 1p/19q codeleted. Oligodendrogliomas often occur in frontal lobes and may spare eloquent areas.",
    "supporting_features": [
      "Eloquent Brain Involvement",
      "Tumor Location"
    ]
  },
  "overall_comment": "Based on the provided metadata, the tumor is classified as Glioblastoma, IDH-wildtype. Confidence is high for IDH wildtype due to advanced age, and moderate-high for non-codeleted status due to location and eloquent involvement.",
  "subject_id": "EGD-0336",
  "who_grade": {
    "confidence": 0.95,
    "contradicting_features": [
      "Enhancement Quality"
    ],
    "prediction": 4,
    "reasoning": "The tumor shows necrosis (Proportion Necrosis: 19.19%) and enhancement (Proportion Enhancing: 11.16%), with thick enhancing margin (>3mm), which are features of glioblastoma (WHO grade 4). Mild enhancement quality may argue against grade 4 but necrosis is a strong indicator.",
    "supporting_features": [
      "Proportion Necrosis",
      "Proportion Enhancing",
      "Thickness of enhancing margin"
    ]
  }
}