{
  "subject_id": "EGD-0388",
  "idh": {
    "reasoning": "The patient is 72 years old, and the tumor shows marked contrast enhancement, a necrotic component (0.48% of volume), large total volume (120\u202fmL), deep white\u2011matter and ependymal invasion, all features that are typical of IDH\u2011wildtype glioblastoma in older adults. Cortical involvement, which is more common in IDH\u2011mutant tumours, is present but does not outweigh the other high\u2011grade imaging signs. Therefore the balance of evidence favors an IDH\u2011wildtype status.",
    "supporting_features": [
      "age_years",
      "Enhancement Quality",
      "Proportion Necrosis",
      "Total tumor volume (mL)",
      "Deep WM invasion",
      "Ependymal (ventricular) Invasion"
    ],
    "contradicting_features": [
      "Cortical involvement"
    ],
    "prediction": "wildtype",
    "confidence": 0.78
  },
  "one_p_nineteen_q": {
    "reasoning": "The lesion is located in temporal, parietal and occipital lobes, involves deep white matter and ventricles, and shows marked enhancement; oligodendrogliomas with 1p/19q codeletion usually arise in the frontal lobe, are less enhancing and occur in younger patients. No imaging clues suggest codeletion, so the most likely status is non\u2011codeleted.",
    "supporting_features": [
      "age_years",
      "Enhancement Quality",
      "Tumor Location",
      "Side of Tumor Epicenter",
      "Multifocal or Multicentric",
      "Proportion Enhancing"
    ],
    "contradicting_features": [
      "Cortical involvement"
    ],
    "prediction": "non-codeleted",
    "confidence": 0.75
  },
  "who_grade": {
    "reasoning": "Marked contrast enhancement, presence of necrosis, large tumour volume (120\u202fmL), extensive oedema (69\u202f% of volume), deep white\u2011matter and ependymal invasion are imaging hallmarks of WHO grade\u202f4 glioblastoma. The enhancing proportion is only 30\u202f% and necrosis is modest, which slightly temper the certainty, but the overall pattern is consistent with grade\u202f4.",
    "supporting_features": [
      "Enhancement Quality",
      "Proportion Necrosis",
      "Total tumor volume (mL)",
      "Deep WM invasion",
      "Ependymal (ventricular) Invasion",
      "Proportion of Oedema"
    ],
    "contradicting_features": [
      "Proportion Enhancing",
      "Cortical involvement"
    ],
    "prediction": 4,
    "confidence": 0.8
  },
  "integrated_diagnosis": "Glioblastoma, IDH-wildtype, CNS WHO grade 4",
  "consistency_check_passed": true,
  "overall_comment": "Imaging strongly suggests an IDH\u2011wildtype glioblastoma (grade\u202f4). Molecular confirmation (IDH sequencing, 1p/19q testing) is required; lack of diffusion/perfusion data limits assessment of microvascular proliferation."
}