{
  "subject_id": "BraTS2021_00273",
  "idh": {
    "reasoning": "The patient's advanced age of 79 is a very strong predictor for IDH-wildtype status. This is strongly corroborated by imaging features characteristic of glioblastoma: a large necrotic core, marked and thick-rimmed enhancement, and deep gray matter involvement (thalamus, basal ganglia). The absence of a T2-FLAIR mismatch further argues against an IDH-mutant astrocytoma. The sharp transition zone on FLAIR is also more typical of IDH-wildtype tumors. There are no contradicting features.",
    "supporting_features": [
      "age_years",
      "NCR Volume (mL)",
      "Enhancement Quality",
      "Thickness of enhancing margin",
      "Anatomical Overlap Regions",
      "T2-FLAIR Mismatch Present",
      "Transition Zone Thickness (FLAIR)"
    ],
    "contradicting_features": [],
    "prediction": "wildtype",
    "confidence": 0.99
  },
  "one_p_nineteen_q": {
    "reasoning": "This classification is performed independently of the IDH prediction. Tumors with 1p/19q co-deletion (oligodendrogliomas) typically present with indistinct borders and minimal to no necrosis or enhancement. This tumor displays the opposite features: marked, thick-rimmed enhancement, a very large necrotic core, and deep anatomical involvement. These aggressive features are highly uncharacteristic of an oligodendroglioma, making a non-codeleted status the most likely prediction.",
    "supporting_features": [
      "Enhancement Quality",
      "NCR Volume (mL)",
      "Thickness of enhancing margin",
      "Anatomical Overlap Regions"
    ],
    "contradicting_features": [],
    "prediction": "non-codeleted",
    "confidence": 0.95
  },
  "who_grade": {
    "reasoning": "The presence of a large necrotic core is a defining feature of WHO Grade 4 gliomas. The metadata confirms a substantial necrotic volume. Additionally, the marked, thick-rimmed contrast enhancement is the classic radiological hallmark of a Grade 4 tumor. The significant mass effect, with a 7mm midline shift, further supports a high-grade diagnosis. There is no evidence to suggest a lower grade.",
    "supporting_features": [
      "NCR Volume (mL)",
      "Proportion Necrosis",
      "Enhancement Quality",
      "Thickness of enhancing margin",
      "midline_shift_present",
      "max_shift_mm"
    ],
    "contradicting_features": [],
    "prediction": 4,
    "confidence": 0.99
  },
  "integrated_diagnosis": "Glioblastoma, IDH-wildtype, CNS WHO Grade 4",
  "consistency_check_passed": true,
  "overall_comment": "The combination of advanced patient age (79) and classic radiological findings\u2014a large, solitary mass with extensive necrosis and thick, marked ring enhancement\u2014provides overwhelming evidence for a Glioblastoma, IDH-wildtype, CNS WHO Grade 4. All individual predictions are made with high confidence and are internally consistent."
}