{
  "consistency_check_passed": true,
  "idh": {
    "confidence": 0.65,
    "contradicting_features": [
      "Enhancement Quality",
      "Proportion Necrosis"
    ],
    "prediction": "mutant",
    "reasoning": "The patient is 51 years old, which is within the typical age range for IDH-mutant gliomas. The tumor is non-enhancing ('Enhancement Quality': 'None') and has a high proportion of necrosis (54.98%), which are features more common in IDH-mutant tumors. However, the absence of enhancement and high necrosis are also seen in some wildtype tumors, reducing confidence.",
    "supporting_features": [
      "age_years",
      "Enhancement Quality",
      "Proportion Necrosis"
    ]
  },
  "integrated_diagnosis": "Astrocytoma, IDH-mutant, CNS WHO grade 4",
  "one_p_nineteen_q": {
    "confidence": 0.55,
    "contradicting_features": [
      "Eloquent Brain Involvement",
      "Tumor Location"
    ],
    "prediction": "non-codeleted",
    "reasoning": "The tumor involves eloquent brain regions ('Eloquent Brain Involvement': 'Vision') and is located in parietal, cortex, and temporal lobes, which are more typical for astrocytomas (non-codeleted) than oligodendrogliomas. However, without specific molecular testing, confidence is moderate.",
    "supporting_features": [
      "Eloquent Brain Involvement",
      "Tumor Location"
    ]
  },
  "overall_comment": "Based on the provided MRI metadata, the tumor is classified as Astrocytoma, IDH-mutant, CNS WHO grade 4. Confidence is moderate due to limited molecular data.",
  "subject_id": "BraTS2021_01483",
  "who_grade": {
    "confidence": 0.7,
    "contradicting_features": [
      "Enhancement Quality"
    ],
    "prediction": 4,
    "reasoning": "The tumor has a high proportion of necrosis (54.98%) and involves eloquent brain regions ('Vision'), which are features of high-grade gliomas (WHO grade 4). The absence of enhancement ('Enhancement Quality': 'None') is atypical for grade 4 gliomas but can occur; thus confidence is moderately high.",
    "supporting_features": [
      "Proportion Necrosis",
      "Eloquent Brain Involvement"
    ]
  }
}