{
  "subject_id": "EGD-0188",
  "idh": {
    "reasoning": "The patient's young age (33 years) is a very strong predictor for an IDH-mutant glioma. Additionally, the tumor exhibits minimal contrast enhancement, with a very small enhancing volume (0.125 mL) and low proportion of enhancement (0.12%), which are characteristic features of IDH-mutant tumors. However, there is strong contradictory evidence: a very large non-enhancing/necrotic core (33.02% of the tumor) is present, which is a hallmark of IDH-wildtype glioblastoma. Furthermore, the absence of the T2-FLAIR mismatch sign argues against an IDH-mutant astrocytoma. Balancing these conflicting features, the patient's age is a dominant demographic predictor, and combined with the lack of significant enhancement, it slightly outweighs the evidence for IDH-wildtype status. The prediction remains uncertain due to these significant contradictions.",
    "supporting_features": [
      "age_years",
      "Enhancement Quality",
      "ET Volume (mL)",
      "Proportion Enhancing"
    ],
    "contradicting_features": [
      "Proportion Necrosis",
      "NCR Volume (mL)",
      "T2-FLAIR Mismatch Present"
    ],
    "prediction": "mutant",
    "confidence": 0.6
  },
  "one_p_nineteen_q": {
    "reasoning": "The evidence for 1p/19q co-deletion status is mixed. A key feature suggesting co-deletion is the very sharp tumor margin, indicated by a low median FLAIR transition zone thickness of 0.75 mm, which is characteristic of oligodendroglioma. However, the presence of a large necrotic core (33.02% of tumor volume) is highly atypical for oligodendroglioma and much more common in high-grade, 1p/19q non-codeleted astrocytomas. The involvement of deep gray matter structures like the putamen and hippocampus is also more frequently seen in astrocytomas. The strong evidence of aggressive biology (necrosis) is a more powerful differentiator of lineage than margin sharpness in this context, thus favoring a non-codeleted status.",
    "supporting_features": [
      "Proportion Necrosis",
      "NCR Volume (mL)",
      "Anatomical Overlap Regions"
    ],
    "contradicting_features": [
      "Transition Zone Thickness (FLAIR)"
    ],
    "prediction": "non-codeleted",
    "confidence": 0.8
  },
  "who_grade": {
    "reasoning": "The prediction of WHO grade is primarily driven by the presence of a large non-enhancing, necrotic core. The metadata indicates that 33.02% of the tumor volume is necrotic, with a substantial absolute volume of 34.671 mL. In the context of an adult-type diffuse glioma, radiographic evidence of necrosis is a strong correlate for histopathological necrosis, which is a defining feature of a WHO grade 4 lesion. While the tumor shows only mild and minimal enhancement, which would typically suggest a lower grade, the presence of necrosis is sufficient to warrant a grade 4 classification. The significant mass effect, with a 9.0 mm midline shift, further supports a high-grade diagnosis.",
    "supporting_features": [
      "Proportion Necrosis",
      "NCR Volume (mL)",
      "midline_shift_present",
      "max_shift_mm"
    ],
    "contradicting_features": [
      "Enhancement Quality",
      "ET Volume (mL)",
      "Proportion Enhancing"
    ],
    "prediction": 4,
    "confidence": 0.9
  },
  "integrated_diagnosis": "Astrocytoma, IDH-mutant, WHO grade 4",
  "consistency_check_passed": true,
  "overall_comment": "This is a challenging case of a large temporal lobe tumor in a young adult with highly conflicting imaging features. The patient's age (33) and minimal contrast enhancement strongly favor an IDH-mutant glioma. However, the presence of a very large necrotic core is a powerful indicator of a WHO grade 4 tumor. The combination of these findings leads to a predicted diagnosis of Astrocytoma, IDH-mutant, WHO grade 4. The sharp tumor margin is an atypical feature for an astrocytoma, introducing some uncertainty, but the evidence for high-grade transformation (necrosis) makes a non-codeleted status most likely. The IDH status prediction carries the lowest confidence due to the conflicting signals."
}