{
  "subject_id": "UCSF-PDGM-438",
  "idh": {
    "reasoning": "The patient is young (38\u202fy) and the lesion is non\u2011enhancing (Enhancement Quality: \"None\", Proportion Enhancing: 0.0) with no necrosis (Proportion Necrosis: 0.0). It is a solitary, cortical frontal lesion without deep white\u2011matter or ependymal invasion and has a small total volume (17.351\u202fmL). These imaging characteristics are typical of low\u2011grade IDH\u2011mutant diffuse gliomas and are inconsistent with the typical contrast\u2011enhancing, necrotic appearance of IDH\u2011wildtype glioblastoma. No imaging feature directly contradicts an IDH\u2011mutant status.",
    "supporting_features": [
      "age_years",
      "Enhancement Quality",
      "Proportion Enhancing",
      "Proportion Necrosis",
      "CET Crosses midline",
      "Edema crosses midline",
      "Ependymal (ventricular) Invasion",
      "Total tumor volume (mL)",
      "Cortical involvement",
      "Multifocal or Multicentric",
      "Deep WM invasion"
    ],
    "contradicting_features": [],
    "prediction": "mutant",
    "confidence": 0.78
  },
  "one_p_nineteen_q": {
    "reasoning": "MRI does not provide definitive evidence for 1p/19q codeletion. The lesion\u2019s frontal, cortical location and lack of enhancement are features that can be seen in both oligodendroglioma (codeleted) and astrocytoma (non\u2011codeleted). Because there is no information on calcifications or characteristic oligodendroglial morphology, the balance of evidence leans slightly toward a non\u2011codeleted status, but the uncertainty is high.",
    "supporting_features": [
      "Enhancement Quality",
      "Proportion Enhancing",
      "Proportion Necrosis",
      "Total tumor volume (mL)",
      "Cortical involvement",
      "age_years"
    ],
    "contradicting_features": [
      "Region Proportions",
      "Tumor Location",
      "Side of Tumor Epicenter"
    ],
    "prediction": "non-codeleted",
    "confidence": 0.55
  },
  "who_grade": {
    "reasoning": "The tumor shows no contrast enhancement, no necrosis, and a modest volume (17\u202fmL). It is confined to cortex and insula without deep white\u2011matter or ependymal invasion, and there is no midline shift. These findings are most compatible with a WHO grade\u202f2 diffuse glioma; higher grades usually demonstrate enhancement, necrosis, or more aggressive infiltration.",
    "supporting_features": [
      "Enhancement Quality",
      "Proportion Enhancing",
      "Proportion Necrosis",
      "Total tumor volume (mL)",
      "ED Volume (mL)",
      "ET Volume (mL)",
      "Cortical involvement",
      "Multifocal or Multicentric"
    ],
    "contradicting_features": [],
    "prediction": 2,
    "confidence": 0.73
  },
  "integrated_diagnosis": "Astrocytoma, IDH-mutant, CNS WHO grade 2",
  "consistency_check_passed": true,
  "overall_comment": "MRI lacks advanced sequences (DWI, perfusion, spectroscopy) and does not show calcifications, limiting confidence in the 1p/19q status. Molecular testing (IDH sequencing and 1p/19q FISH or PCR) is recommended to confirm the integrated diagnosis."
}