{
  "consistency_check_passed": true,
  "idh": {
    "confidence": 0.55,
    "contradicting_features": [
      "Eloquent Brain Involvement",
      "Enhancement Quality",
      "Proportion Necrosis"
    ],
    "prediction": "wildtype",
    "reasoning": "The tumor involves eloquent areas (Speech motor and Motor) and shows mild enhancement, which are more common in IDH-wildtype gliomas. However, the proportion of necrosis is high (64.26%), which is atypical for IDH-wildtype gliomas that usually have less necrosis. The frontal lobe location and cortical involvement are non-specific. Given the conflicting evidence, IDH-wildtype is slightly favored but with low confidence.",
    "supporting_features": [
      "Eloquent Brain Involvement",
      "Enhancement Quality"
    ]
  },
  "integrated_diagnosis": "",
  "one_p_nineteen_q": {
    "confidence": 0.5,
    "contradicting_features": [
      "Deep WM invasion",
      "Eloquent Brain Involvement"
    ],
    "prediction": "non-codeleted",
    "reasoning": "The tumor shows deep white matter invasion and involves eloquent areas, which are more typical of astrocytomas (non-codeleted) than oligodendrogliomas. However, frontal lobe predominance and cortical involvement can be seen in both. No specific features strongly indicate co-deletion status. Evidence is insufficient, so non-codeleted is predicted with low confidence.",
    "supporting_features": [
      "Deep WM invasion",
      "Eloquent Brain Involvement"
    ]
  },
  "overall_comment": "",
  "subject_id": "EGD-0537",
  "who_grade": {
    "confidence": 0.6,
    "contradicting_features": [
      "Enhancement Quality"
    ],
    "prediction": 4,
    "reasoning": "The tumor has a high proportion of necrosis (64.26%), which is characteristic of glioblastoma (WHO grade 4). Mild enhancement and solitary lesion are also consistent with grade 4. However, mild enhancement is less typical than ring enhancement for GBM. The absence of ependymal invasion argues against grade 4 but necrosis is a stronger indicator. Grade 4 is predicted with moderate confidence.",
    "supporting_features": [
      "Proportion Necrosis",
      "Total tumor volume (mL)"
    ]
  }
}