{
  "subject_id": "EGD-0074",
  "idh": {
    "reasoning": "The patient's age of 38 is more typical for IDH-mutant gliomas. The tumor's location in the frontal lobe, cortical involvement, and extremely sharp borders (thin transition zone) are classic features of IDH-mutant tumors, particularly oligodendroglioma. The lack of significant contrast enhancement also supports this. The main contradictory feature is the large non-enhancing core, representing 30% of the tumor volume, which is highly suggestive of necrosis and more commonly associated with IDH-wildtype glioblastoma. However, given the constellation of other features strongly pointing to a less aggressive biology (sharp margins, minimal enhancement), an IDH-mutant status is more probable, with the non-enhancing core possibly representing cystic change or necrosis within a higher-grade IDH-mutant tumor.",
    "supporting_features": [
      "age_years",
      "Tumor Location",
      "Cortical involvement",
      "Transition Zone Thickness (FLAIR)",
      "ET Volume (mL)",
      "Enhancement Quality"
    ],
    "contradicting_features": [
      "NCR Volume (mL)",
      "Proportion Necrosis"
    ],
    "prediction": "mutant",
    "confidence": 0.65
  },
  "one_p_nineteen_q": {
    "reasoning": "The imaging phenotype is highly characteristic of an oligodendroglioma (which are, by definition, 1p/19q-codeleted). The tumor is located in the frontal lobe with cortical involvement and has remarkably well-defined margins, as evidenced by the very thin FLAIR transition zone and high boundary sharpness. This 'bubbly' or well-circumscribed appearance is a classic feature of 1p/19q-codeleted tumors. The absence of the T2-FLAIR mismatch sign argues against an IDH-mutant astrocytoma, the primary differential for a non-codeleted tumor. The main contradictory evidence is the large proportion of necrosis, which is less typical for oligodendrogliomas than for astrocytomas, but can be seen in anaplastic (grade 3) variants. The strength of the boundary features outweighs the non-specific finding of necrosis.",
    "supporting_features": [
      "Tumor Location",
      "Cortical involvement",
      "Transition Zone Thickness (FLAIR)",
      "boundary_sharpness",
      "T2-FLAIR Mismatch Present"
    ],
    "contradicting_features": [
      "Proportion Necrosis",
      "NCR Volume (mL)"
    ],
    "prediction": "codeleted",
    "confidence": 0.7
  },
  "who_grade": {
    "reasoning": "The presence of a large non-enhancing core, comprising 30% of the tumor volume, is a strong indicator of high-grade disease, making a WHO grade 2 diagnosis highly unlikely. This feature, likely representing necrosis, is a hallmark of WHO grade 4 glioblastoma. However, the tumor almost completely lacks contrast enhancement and has very sharp, non-infiltrative borders, which are features that strongly argue against a grade 4 diagnosis. A WHO grade 3 diagnosis provides the best reconciliation of this conflicting evidence, as it can account for the presence of necrosis (anaplastic feature) while also being consistent with the lack of florid enhancement and well-defined margins.",
    "supporting_features": [
      "NCR Volume (mL)",
      "Proportion Necrosis"
    ],
    "contradicting_features": [
      "ET Volume (mL)",
      "Enhancement Quality",
      "Transition Zone Thickness (FLAIR)",
      "Total tumor volume (mL)"
    ],
    "prediction": 3,
    "confidence": 0.75
  },
  "integrated_diagnosis": "Oligodendroglioma, IDH-mutant and 1p/19q-codeleted, CNS WHO grade 3",
  "consistency_check_passed": true,
  "overall_comment": "The imaging findings present a conflicting picture but are most consistent with an anaplastic oligodendroglioma. The frontal lobe location and exceptionally sharp tumor margins strongly suggest an IDH-mutant, 1p/19q-codeleted lineage. The primary challenge is the presence of a large non-enhancing/necrotic core, a feature of high-grade disease. While necrosis is a criterion for grade 4 in astrocytic tumors, the profound lack of enhancement makes a grade 4 diagnosis less probable. The most likely integrated diagnosis is an Oligodendroglioma, IDH-mutant and 1p/19q-codeleted, CNS WHO grade 3."
}