{
  "subject_id": "BraTS2021_00521",
  "idh": {
    "reasoning": "The presence of multiple distinct lesions ('Multifocal or Multicentric': 'Multifocal', 'Number of lesions': 3) is a very strong predictor for IDH-wildtype status. Additionally, the presence of both contrast enhancement ('ET Volume (mL)': 6.663) and necrosis ('NCR Volume (mL)': 1.715), along with extensive vasogenic edema ('ED Volume (mL)': 110.274), are classic features of IDH-wildtype gliomas, particularly glioblastoma. While the tumor involves the insula and temporal lobe, which can be seen in IDH-mutant tumors, the combination of multifocality, enhancement, and necrosis overwhelmingly favors an IDH-wildtype diagnosis.",
    "supporting_features": [
      "Multifocal or Multicentric",
      "Number of lesions",
      "ET Volume (mL)",
      "NCR Volume (mL)",
      "ED Volume (mL)"
    ],
    "contradicting_features": [
      "Tumor Location"
    ],
    "prediction": "wildtype",
    "confidence": 0.95
  },
  "one_p_nineteen_q": {
    "reasoning": "The imaging phenotype is strongly indicative of an astrocytic lineage tumor, making 1p/19q co-deletion highly improbable. Key features arguing against co-deletion include the tumor's multifocal nature ('Multifocal or Multicentric': 'Multifocal'), the presence of necrosis ('NCR Volume (mL)': 1.715), and the vast amount of vasogenic edema ('ED Volume (mL)': 110.274). Oligodendrogliomas (which are 1p/19q co-deleted) are rarely multifocal, typically lack necrosis until high grade, and usually present with less extensive, more infiltrative T2/FLAIR signal abnormality rather than this degree of edema. The overall presentation is classic for a high-grade astrocytoma (non-codeleted).",
    "supporting_features": [
      "Multifocal or Multicentric",
      "NCR Volume (mL)",
      "ET Volume (mL)",
      "ED Volume (mL)",
      "Tumor Location"
    ],
    "contradicting_features": [],
    "prediction": "non-codeleted",
    "confidence": 0.98
  },
  "who_grade": {
    "reasoning": "The presence of central necrosis ('NCR Volume (mL)': 1.715) in a diffusely infiltrating glioma is a defining radiological feature of CNS WHO grade 4. This is further supported by the presence of contrast enhancement ('ET Volume (mL)': 6.663), a thick enhancing margin ('Thickness of enhancing margin': '>3mm'), and significant mass effect evidenced by an effaced left ventricle ('Effaced Ventricle': 'Left') and extensive edema ('ED Volume (mL)': 110.274). The multifocal presentation ('Multifocal or Multicentric': 'Multifocal') is also characteristic of grade 4 disease. There are no features to suggest a lower grade; the combination of enhancement and necrosis is definitive for grade 4.",
    "supporting_features": [
      "NCR Volume (mL)",
      "ET Volume (mL)",
      "Thickness of enhancing margin",
      "Multifocal or Multicentric",
      "ED Volume (mL)",
      "Effaced Ventricle"
    ],
    "contradicting_features": [],
    "prediction": 4,
    "confidence": 0.99
  },
  "integrated_diagnosis": "Glioblastoma, IDH-wildtype, CNS WHO grade 4",
  "consistency_check_passed": true,
  "overall_comment": "The MRI features are highly characteristic of a glioblastoma. The multifocal nature, presence of both contrast enhancement and necrosis, and extensive surrounding edema are classic findings for a Glioblastoma, IDH-wildtype, CNS WHO grade 4. The confidence in this diagnosis is very high based on the provided imaging metadata."
}