{
  "subject_id": "BraTS2021_00005",
  "idh": {
    "reasoning": "The available metadata provides limited information to directly infer IDH mutation status. Features like tumor size (120.679 mL), location (parietal, cortex, frontal lobe), and enhancement pattern (marked, >3mm margin) are non-specific regarding IDH status. The presence of deep white matter invasion and ependymal invasion are common in both IDH-mutant and IDH-wildtype gliomas, although perhaps slightly more characteristic of IDH-wildtype tumors. The large tumor volume and significant edema (62.03% proportion) could suggest a higher grade, which is more common in IDH-wildtype tumors, but this is not definitive. Without features like age (often younger in IDH-mutant), specific imaging characteristics strongly associated with IDH mutation (e.g., minimal edema, well-defined margins - which are absent here), or molecular markers (not available), a definitive prediction is difficult. Given the large size, significant edema, and deep/ependymal invasion, IDH-wildtype is slightly more likely, but the evidence is weak.",
    "supporting_features": [
      "Total tumor volume (mL)",
      "Proportion of Oedema",
      "Deep WM invasion",
      "Ependymal (ventricular) Invasion"
    ],
    "contradicting_features": [],
    "prediction": "wildtype",
    "confidence": 0.55
  },
  "one_p_nineteen_q": {
    "reasoning": "The provided metadata does not contain any information relevant to determining 1p/19q co-deletion status. This status is typically assessed via molecular testing (FISH or sequencing) and cannot be reliably predicted from standard MRI sequences like T1w, T2w, T2-FLAIR, and T1-Gd alone. There are no imaging features described that are specifically indicative of 1p/19q co-deletion.",
    "supporting_features": [],
    "contradicting_features": [],
    "prediction": "non-codeleted",
    "confidence": 0.5
  },
  "who_grade": {
    "reasoning": "The tumor exhibits several features suggestive of a high WHO grade. It is large (Total tumor volume 120.679 mL), shows marked enhancement with a thick margin (>3mm), involves deep white matter ('Deep WM invasion': 'Present'), demonstrates ependymal invasion ('Ependymal (ventricular) Invasion': 'Present'), causes significant mass effect with midline shift ('midline_shift_present': 'Yes') and ventricular effacement ('Effaced Ventricle': 'Left'), and has substantial edema ('Proportion of Oedema': 62.03%, 'Edema crosses midline': 'True'). Cortical involvement ('Cortical involvement': 'Present') is also noted. These features collectively point towards aggressive behavior characteristic of Grade 4 glioma (Glioblastoma). While Grade 3 gliomas can also show some of these features, the combination of marked enhancement, deep/ependymal invasion, significant edema crossing the midline, and large size strongly favors Grade 4.",
    "supporting_features": [
      "Total tumor volume (mL)",
      "Enhancement Quality",
      "Thickness of enhancing margin",
      "Deep WM invasion",
      "Ependymal (ventricular) Invasion",
      "midline_shift_present",
      "Effaced Ventricle",
      "Proportion of Oedema",
      "Edema crosses midline",
      "Cortical involvement"
    ],
    "contradicting_features": [],
    "prediction": 4,
    "confidence": 0.85
  },
  "integrated_diagnosis": "",
  "consistency_check_passed": false,
  "overall_comment": ""
}